{
  "$schema": "https://raw.githubusercontent.com/VitexSoftware/php-vitexsoftware-multiflexi-core/refs/heads/main/schema/credential-prototype.json",
  "uuid": "745787fe-27da-4b50-a441-d96925d84be0",
  "code": "VaultWarden",
  "name": "VaultWarden",
  "description": "Use VaultWarden secrets",
  "version": "1.0",
  "logo": "vaultwarden.svg",
  "homepage": "https://github.com/dani-garcia/vaultwarden",
  "tags": [
    "VaultWarden",
    "passwords",
    "secrets",
    "security"
  ],
  "fields": [
    {
      "keyword": "VAULTWARDEN_URL",
      "type": "url",
      "name": "VaultWarden URL",
      "description": "URL instance VaultWarden",
      "required": true
    },
    {
      "keyword": "VAULTWARDEN_USERNAME",
      "type": "string",
      "name": "VaultWarden User login",
      "description": "VaultWarden login username",
      "required": true
    },
    {
      "keyword": "VAULTWARDEN_PASSWORD",
      "type": "password",
      "name": "VaultWarden User password",
      "description": "VaultWarden login password",
      "required": true
    },
    {
      "keyword": "VAULTWARDEN_FOLDER",
      "type": "string",
      "name": "VaultWarden Folder",
      "description": "Name of the VaultWarden secrets folder",
      "required": false
    }
  ]
}
